id_tema,palabras_clave,nombre_tema
1,"puto, puta, hijo, verguenza, asco, jeta, madre, gran, panda, parasito",Insultos graves y deshumanización
2,"mas, hacer, poder, gobierno, españa, decir, dar, ser, pais, solo",Crítica política agresiva
3,"mierdo, sinverguenza, menudo, fascista, pobre, hacer, vaya, facha, ser, culo",Descalificaciones ideológicas
4,"mierda, informativo, terrorismo, mierdar, socialista, vulgaridad, bori, iro, arrogante, chino",Lenguaje violento contra colectivos
5,"inutil, terrorista, basura, gilipolla, maldito, payaso, envidioso, ascir, tirar, subir",Ataques personales intensos
